_id,Sentence,Company,Sentiment,Type,Coarse-Grained Event,Fine-Grained Event,Industry
17293,I don't see it. 200 day sma is the big hurdle. There is a good base building. $NFLX  https://t.co/ImKYGO2cyc,NFLX,POS,post,Stock Affairs,Stock Price Movement,Entertainment
17304,Daily Mail parent company in talks with potential partners about joint bid for Yahoo's internet assets: https://t.co/mK7MEMtADT $YHOO,YHOO,POS,post,Financing and Investment,Mergers and Acquisitions,Interactive Media & Services
17343,expecting  $SPY to close above 205.20 $AAPL,SPY,POS,post,Stock Affairs,Stock Price Movement,Financial Services
17345,"$FB trending nicely, intraday.",FB,POS,post,Stock Affairs,Stock Price Movement,Interactive Media & Services
17348,Starbucks' Digital Strategy To Drive Significant Growth With Customer Loyalty $SBUX https://t.co/Xk6lZ3UI3K,SBUX,POS,post,Business Operations,Other Business Operations Affairs,"Hotels, Restaurants & Leisure"
17359,"$QCOM chart: Qualcomm Short 61.8% Retracement, Trendline and Resistance. https://t.co/2WQqh35KOY",QCOM,NEG,post,Stock Affairs,Stock Price Movement,Semiconductors & Semiconductor Equipment
17373,"$INTU is in the process of streamlining its structure, especially through divestment of non-core businesses   https://t.co/dR5baNun2u",INTU,POS,post,Business Operations,Other Business Operations Affairs,Software
17383,"$TSLA steaming up again, this stock is relentless at the moment",TSLA,POS,post,Stock Affairs,Stock Price Movement,Automobiles
17387,.@barronsonline sees #Apple at $150/share in a year (+36% from today) on growing services business. $AAPL https://t.co/3BDNEKN7l1,AAPL,POS,post,Stock Affairs,Other Stock Affairs,Household Durables
17404,Adobe Receives New Rating from Top Analyst $ADBE https://t.co/LJNXPEvHZN,ADBE,POS,post,Financial Affairs,Other Financial Affairs,Software
17409,Activision Blizzard Media Networks Announces Record #Esports Viewership https://t.co/729BiqLbtK $ATVI partnered with $HDSI for 9 #tournament,HDSI,POS,post,Financial Affairs,Other Financial Affairs,Biotechnology
17423,"Also, BMO had just initiated $incy with an outperform yesterday, while several other firms all reiterated buy ratings.",INCY,POS,post,Stock Affairs,Other Stock Affairs,Biotechnology
645,"Britain's FTSE steadies, supported by Dixons Carphone",Dixons Carphone,POS,headline,Stock Affairs,Stock Price Movement,Specialty Retail
651,Glaxo's ViiV Healthcare Signs China Manufacturing Deal With Desano,Glaxo,POS,headline,Business Operations,Initiating Cooperation,Pharmaceuticals
653,AstraZeneca sells Caprelsa rights to Sanofi unit,Sanofi,POS,headline,Business Operations,Initiating Cooperation,Pharmaceuticals
659,UPDATE 5-Barclays Chairman McFarlane axes CEO to speed up strategic change,Barclays,NEG,headline,Business Operations,Other Business Operations Affairs,Banks
665,Miners Meltdown as BHP to Rio Tinto Sink in Commodities Rout,Rio Tinto,NEG,headline,Stock Affairs,Stock Price Movement,Metals & Mining
669,"FTSE led lower by M&S, GlaxoSmithKline",M&S,NEG,headline,Stock Affairs,Stock Price Movement,Broadline Retail
67,Morrisons faces festive sales test,Morrisons,NEG,headline,Financial Affairs,Other Financial Affairs,Consumer Staples Distribution & Retail
670,GKN to buy Fokker Technologies for 706 mln euros,GKN,POS,headline,Financing and Investment,Mergers and Acquisitions,Aerospace & Defense
671,Diageo Sells Ryder Cup Venue Gleneagles Hotel to Ennismore Group,Gleneagles Hotel,POS,headline,Business Operations,Initiating Cooperation,"Hotels, Restaurants & Leisure"
671,Diageo Sells Ryder Cup Venue Gleneagles Hotel to Ennismore Group,Ennismore Group,POS,headline,Business Operations,Initiating Cooperation,"Hotels, Restaurants & Leisure"
674,"UPDATE: CIB, Legal & General Sell Egyptian Life Joint Venture To AXA",CIB,POS,headline,Business Operations,Initiating Cooperation,Banks
679,Chime Communications Set To Be Acquired By WPP And Providence,WPP,POS,headline,Financing and Investment,Mergers and Acquisitions,Media
680,"CompaniesNew Aggreko CEO to reshape business, strip costs",Aggreko,POS,headline,Business Operations,Other Business Operations Affairs,Machinery
682,AstraZeneca to Pay Inovio Up to $700 Million for Cancer Drug,Inovio,POS,headline,Business Operations,Initiating Cooperation,Biotechnology
686,Rio Tinto CEO says iron ore market at equilibrium,Rio Tinto,NEU,headline,Business Operations,"Sales, Market Share Changes",Metals & Mining
687,US sanctions put Gazprom-Shell alliance plans in jeopardy,Shell,NEG,headline,Compliance and Credit,Other Compliance and Credit Affairs,"Oil, Gas & Consumable Fuels"
688,Standard Chartered Not Raising Capital Yet As Dividend Cut,Standard Chartered,NEG,headline,Shareholder Affairs,Other Shareholder Affairs,Banks
69,Tesco share price dips as Blinkbox Books closes ending supermarket's digital ...,Tesco,NEG,headline,Stock Affairs,Stock Price Movement,Consumer Staples Distribution & Retail
69,Tesco share price dips as Blinkbox Books closes ending supermarket's digital ...,Blinkbox,NEG,headline,Stock Affairs,Stock Price Movement,Entertainment
692,"UPDATE 1-BHP Billiton's credit ratings fragile in FY16, agencies warn",BHP,NEG,headline,Compliance and Credit,Other Compliance and Credit Affairs,Metals & Mining
693,CRH adds CR Laurence to acquisitions tally for $1.3bn,CRH,POS,headline,Financing and Investment,Mergers and Acquisitions,Construction Materials
7,Stakes High for AstraZeneca Heart Drug Facing Tough Competition,AstraZeneca,NEG,headline,Compliance and Credit,Other Compliance and Credit Affairs,Pharmaceuticals
70,Shire to buy NPS for $5.2 billion to boost rare disease drugs,Shire,POS,headline,Financing and Investment,Mergers and Acquisitions,Pharmaceuticals
701,Novartis buys remaining rights to GSK treatment in deal up to $1 billion,Novartis,POS,headline,Business Operations,Initiating Cooperation,Pharmaceuticals
702,"AstraZeneca bags another cancer drug deal, this time with Inovio",Inovio,POS,headline,Business Operations,Initiating Cooperation,Biotechnology
704,REFILE-Aviva Investors to move 34 bln euros in assets from AXA fund arm,AXA,NEG,headline,Financing and Investment,Capital Flows,Insurance
715,"L&G still paying price for dividend cut during crisis, chief says",L&G,NEG,headline,Shareholder Affairs,Other Shareholder Affairs,Capital Markets
726,Buffett's Company Reports 37 Percent Drop in 2Q Earnings,Berkshire Hathaway Inc.,NEG,headline,Business Operations,Other Business Operations Affairs,Insurance
730,Travis Perkins Hikes Dividend 20% As Profit And Revenue Rise,Travis Perkins,POS,headline,Shareholder Affairs,Other Shareholder Affairs,Trading Companies & Distributors
738,"Tesco, Asda sales fall as march of the discounters continues: Kantar",Tesco,NEG,headline,Financial Affairs,Other Financial Affairs,Consumer Staples Distribution & Retail
741,Shire proposes $30 bln all-share tie-up with Baxalta,Shire,POS,headline,Financing and Investment,Mergers and Acquisitions,Pharmaceuticals
742,Shire CEO steps up drive to get Baxalta board talking,Shire,POS,headline,Business Operations,Other Business Operations Affairs,Pharmaceuticals
747,"Tesco, Asda sales fall as march of the discounters continues-Kantar",Asda,NEG,headline,Business Operations,"Sales, Market Share Changes",Consumer Staples Distribution & Retail
758,Verizon and AT&T accused of hurting rivals,Verizon,NEG,headline,Compliance and Credit,Regulatory Inquiries,Diversified Telecommunication Services
759,"FTSE 100 falls as China devaluation hits Burberry, mining stocks",Burberry,NEG,headline,Stock Affairs,Stock Price Movement,"Textiles, Apparel & Luxury Goods"
76,AstraZeneca's MedImmune Inks Licensing Deal With Omnis Pharmaceuticals,Omnis Pharmaceuticals,POS,headline,Business Operations,Initiating Cooperation,Biotechnology
764,"Nine banks including Barclays, Citi, agree to pay $2 billion to settle forex ...",Citi,NEG,headline,Compliance and Credit,Company Litigation,Banks
78,FDA approves Shire's Vyvanse for binge-eating disorder,Shire,POS,headline,Compliance and Credit,Regulatory Inquiries,Pharmaceuticals
784,CompaniesCar insurer Hastings Group driving Â£180m IPO,Hastings Group,POS,headline,Stock Affairs,Stock Status,Insurance
8,UPDATE 1-Dairy Crest loses a third of Morrisons milk contract,Morrisons,NEG,headline,Business Operations,"Sales, Market Share Changes",Consumer Staples Distribution & Retail
808,Glencore slumps 25 pct as debt fears grow,Glencore,NEG,headline,Compliance and Credit,Other Compliance and Credit Affairs,Metals & Mining
815,Horizonte acquires neighbouring Glencore nickel property in Brazil,Horizonte,POS,headline,Financing and Investment,Mergers and Acquisitions,Metals & Mining
82,Companies Thetrainline.com announces arrival of London IPO,Thetrainline.com,POS,headline,Stock Affairs,Stock Status,"Hotels, Restaurants & Leisure"
820,UPDATE 1-Engineering firm Smiths Group confirms CEO appointment,Morrissons,POS,headline,Management Affairs,"Directors, Supervisors, and Senior Executives Dynamics",Consumer Staples Distribution & Retail
821,Industry NewsMorrisons unveils which stores will close as 900 jobs face the axe,Morrissons,NEG,headline,Business Operations,Other Business Operations Affairs,Consumer Staples Distribution & Retail
827,Glencore slumps 30 percent as debt fears grow,Glencore,NEG,headline,Compliance and Credit,Other Compliance and Credit Affairs,Metals & Mining
833,Aberdeen Asset Management Gains Foothold In China,Aberdeen Asset Managment,POS,headline,Business Operations,Other Business Operations Affairs,Capital Markets
835,ARM Holdings plc Partners With International Business Machines Corp. To Drive ...,ARM Holdings,POS,headline,Business Operations,Other Business Operations Affairs,Semiconductors & Semiconductor Equipment
835,ARM Holdings plc Partners With International Business Machines Corp. To Drive ...,IBM,POS,headline,Business Operations,Other Business Operations Affairs,IT Services
838,"FTSE 100 drops 2.5 pct on Glencore, metals price fears",Glencore,NEG,headline,Stock Affairs,Stock Price Movement,Metals & Mining
840,"After Barclays and Bank of America, Citigroup has blockchain in sight",Barclays,POS,headline,Financing and Investment,Investment Events,Banks
840,"After Barclays and Bank of America, Citigroup has blockchain in sight",Citigroup,POS,headline,Financing and Investment,Investment Events,Banks
841,AB InBev approaches SABMiller to explore $250bn tie-up,SAB Miller,POS,headline,Financing and Investment,Mergers and Acquisitions,Beverages
847,EU regulator backs approval for GSK injectable asthma drug,GSK,POS,headline,Compliance and Credit,Regulatory Inquiries,Pharmaceuticals
855,Glencore fight back over debt fears lifts shares,Glencore,POS,headline,Compliance and Credit,Other Compliance and Credit Affairs,Metals & Mining
856,"News FeedFTSE 100 movers: Ashtead jumps on strong interims; Glencore, BP in ...",Ashtead,POS,headline,Financial Affairs,Other Financial Affairs,Commercial Services & Supplies
858,Brewer AB InBev seeks $275 bln tie-up with SABMiller,SABMiller,POS,headline,Financing and Investment,Mergers and Acquisitions,Beverages
861,AB InBev looks to win over SABMiller investors,SABMiller,POS,headline,Financing and Investment,Mergers and Acquisitions,Beverages
863,UPDATE 1-EU regulator backs approval for GSK injectable asthma drug,GSK,POS,headline,Compliance and Credit,Regulatory Inquiries,Pharmaceuticals
866,Copper market may get a 2003-style supply shock from Glencore closures,Glencore,NEG,headline,Business Operations,"Sales, Market Share Changes",Metals & Mining
87,Breakingviews: IAG can pay more for Aer Lingus,IAG,POS,headline,Financing and Investment,Mergers and Acquisitions,Metals & Mining
872,TalkTalk hires BAE Systems to investigate cyber attack,TalkTalk,NEG,headline,Management Affairs,Employee Dynamics,Wireless Telecommunication Services
876,Renewed AB InBev Bid for SABMiller Ups Stake in Beer Battle,SAB Miller,POS,headline,Financing and Investment,Mergers and Acquisitions,Beverages
879,CompaniesAB InBev signals it won't go hostile for SABMiller,SAB Miller,POS,headline,Business Operations,Other Business Operations Affairs,Beverages
88,Tesco share price jumps as Q3 sales top estimates,Tesco,POS,headline,Stock Affairs,Stock Price Movement,Consumer Staples Distribution & Retail
885,AstraZeneca diabetes drug combination faces delay after FDA rebuff,AstraZeneca,NEG,headline,Compliance and Credit,Other Compliance and Credit Affairs,Pharmaceuticals
891,Mylan Appoints Ranjan Ray Chaudhuri as Global Commercial Lead for Mylan's Over ...,Mylan,NEU,headline,Management Affairs,"Directors, Supervisors, and Senior Executives Dynamics",Pharmaceuticals
896,SABMiller revenue hit by weaker EM currencies,SAB Miller,NEG,headline,Stock Affairs,Other Stock Affairs,Beverages
897,UPDATE 5-SABMiller rejects AB InBev's $104 bln takeover approach,SAB Miller,POS,headline,Financing and Investment,Mergers and Acquisitions,Beverages
90,CRH's concrete bid for Holcim Lafarge assets,Holcim Lafarge,POS,headline,Stock Affairs,Stock Price Movement,Construction Materials
907,Market Report: Eight-day rally ends for FTSE 100 and Standard Chartered,Standard Chartered,POS,headline,Business Operations,"Sales, Market Share Changes",Banks
908,AB InBev offers SABMiller $3 billion breakup fee,SAB Miller,POS,headline,Financing and Investment,Mergers and Acquisitions,Beverages
912,GSK joins China trade push as UK trumpets healthcare deals,GSK,POS,headline,Business Operations,Other Business Operations Affairs,Pharmaceuticals
914,AB InBev ups offer for SABMiller as deadline looms,SAB Miller,POS,headline,Financing and Investment,Mergers and Acquisitions,Beverages
919,Tesco PLC's Recovery Continues With A Â£250m Cash Infusion,Tesco,POS,headline,Financial Affairs,Other Financial Affairs,Consumer Staples Distribution & Retail
922,"METALS-Zinc surges 12 pct after Glencore cuts output, fuelling metals rally",Glencore,POS,headline,Stock Affairs,Stock Price Movement,Metals & Mining
924,CompaniesUnilever sales lifted by ice cream in soft economy,Unilever,POS,headline,Financial Affairs,Other Financial Affairs,Household Products
939,AB InBev's Latest Bid Said Unlikely to Win SABMiller's Approval,SABMiller,POS,headline,Business Operations,Other Business Operations Affairs,Beverages
94,Persimmon share price climbs on 23% rise in full-year revenue,Persimmon,POS,headline,Stock Affairs,Stock Price Movement,Household Durables
941,Britain's FTSE forges ahead as Shire surges,Shire,POS,headline,Stock Affairs,Stock Price Movement,Pharmaceuticals
942,AB InBev attacks SABMiller bid rebuffal,SABMiller,NEG,headline,Financing and Investment,Mergers and Acquisitions,Beverages
943,Anheuser-Busch InBev Increases Offer for Rival SABMiller,SABMiller,POS,headline,Financing and Investment,Mergers and Acquisitions,Beverages
945,Why I'd Buy ARM Holdings plc And BHP Billiton plc Today,BHP Billiton,POS,headline,Business Operations,Other Business Operations Affairs,Metals & Mining
946,Barclays PLC & Lloyds Banking Group PLC Are The 2 Banks I'd Buy Today,Lloyds,POS,headline,Business Operations,Other Business Operations Affairs,Banks
952,EasyJet Dismisses Lufthansa Low-Cost Plan in Contest for Germany,Lufthansa,NEG,headline,Business Operations,Other Business Operations Affairs,Passenger Airlines
96,Ruling sets lower limit on potential fine for BP,BP,NEG,headline,Compliance and Credit,Legal Affairs,"Oil, Gas & Consumable Fuels"
963,"EXCLUSIVE-BP, China's CNPC to unveil oil alliance - sources",CNPC,POS,headline,Business Operations,Other Business Operations Affairs,"Oil, Gas & Consumable Fuels"
965,SAB's Chairman Digs In With Board Divided on InBev Offer,SABMiller,POS,headline,Business Operations,Other Business Operations Affairs,Beverages
966,Kinder Morgan and BP Form Joint Venture Limited Liability Company to Purchase ...,Kinder Morgan,POS,headline,Business Operations,Initiating Cooperation,"Oil, Gas & Consumable Fuels"
967,Supreme Court Upholds $236 Million Jury Award Against ExxonMobil,ExxonMobil,NEG,headline,Compliance and Credit,Legal Affairs,"Oil, Gas & Consumable Fuels"
972,Standard Chartered's Shares Plunge 7% After Fitch Downgrade,Standard Chartered,NEG,headline,Stock Affairs,Other Stock Affairs,Banks
98,Reed Elsevier share price slides on underwhelming full-year results,Reed Elsevier,NEG,headline,Stock Affairs,Stock Price Movement,Professional Services
980,WPP wins race for 'programmatic buying' agency Essence Digital,WPP,POS,headline,Financing and Investment,Mergers and Acquisitions,Media
981,BHP Billiton share price: Brazil to sue Samarco for Â£3.5bn,Samarco,NEG,headline,Compliance and Credit,Company Litigation,Metals & Mining
986,G4S slides on balance sheet worries,G4S,NEG,headline,Compliance and Credit,Other Compliance and Credit Affairs,Commercial Services & Supplies
988,FDA approves AstraZeneca drug for advanced lung cancer,AstraZeneca,POS,headline,Compliance and Credit,Regulatory Inquiries,Pharmaceuticals
99,UPDATE 1-Meggitt reiterates annual outlook after tough 2014,Meggitt,POS,headline,Financial Affairs,Other Financial Affairs,Aerospace & Defense
991,HSBC appoints business leaders to board,HSBC,POS,headline,Management Affairs,"Directors, Supervisors, and Senior Executives Dynamics",Banks
999,"HSBC shakes up board with two new business chiefs, three departures",HSBC,NEG,headline,Management Affairs,"Directors, Supervisors, and Senior Executives Dynamics",Banks
18014,"Last month we added to our $GILD position and started a new one in $BWLD We see slow, steady, unspectacular growth going forward near term",GILD,POS,post,Financial Affairs,Other Financial Affairs,Pharmaceuticals
18047,"$TSLA lots of green on the 5 min, watch the hourly $259.33 possible resistance currently @ $257.00",TSLA,POS,post,Stock Affairs,Stock Price Movement,Automobiles
18050,$AMGN And #UCB Announce Positive Top-Line Results From Ph3 Study Evaluating Romosozumab In Men... https://t.co/4hBoUDR8B8 via @YahooFinance,AMGN,POS,post,Financial Affairs,Other Financial Affairs,Pharmaceuticals
18061,Sold some $TSLA Puts this morning Closed them at the close. Helps pay for monthly expenses,TSLA,NEG,post,Stock Affairs,Stock Price Movement,Automobiles
18075,Windows 10 is awful why did it force an upgrade on my pc without my consent? #windows #Microsoft $msft,MSFT,NEG,post,Business Operations,Product Dynamics,Software
18077,$EXPE working on the second leg of its reversal run as it breaks another down trend and continues higher. https://t.co/76DSJysyR0,EXPE,POS,post,Stock Affairs,Stock Price Movement,"Hotels, Restaurants & Leisure"
18078,"$ENDP exit reversal .11 X 3K shares = $330 - now Long - not getting follow through, either side of price action",ENDP,POS,post,Stock Affairs,Stock Price Movement,Biotechnology
18088,$CTRP not a bad long chart now that it's through sma100 resistance.,CTRP,POS,post,Stock Affairs,Stock Price Movement,Interactive Media & Services
18096,$ENDP Was looking for a long entry but today's price action wasn't appealing,ENDP,POS,post,Stock Affairs,Stock Price Movement,Biotechnology
18097,"$INTC & $AAPL strong, tech leads DOW higher",INTC,POS,post,Stock Affairs,Stock Price Movement,Semiconductors & Semiconductor Equipment
18100,$CTRP breaking out https://t.co/Z2je3rTKch,CTRP,POS,post,Stock Affairs,Stock Price Movement,Interactive Media & Services
18107,$CSX another strong rail today after breaking intraday resistance at 1$9.80 https://t.co/eA4FBVuqGP,CSX,POS,post,Stock Affairs,Stock Price Movement,Ground Transportation
18124,loading $SPY and $AAPL puts. think were toppy IMHO.,SPY,NEG,post,Stock Affairs,Stock Price Movement,Financial Services
18126,bot $AMZN 600 weekly calls here @ 5.93,AMZN,POS,post,Stock Affairs,Stock Price Movement,Broadline Retail
18143,$FB watching for bounce tomorrow,FB,POS,post,Stock Affairs,Stock Price Movement,Interactive Media & Services
18145,#Fintech provider $CAFN Cachet Financial Solutions Surging Forward today post earnings Up +13.26% https://t.co/9BJ3csk2i9 $JKHY $FISV #Momo,CAFN,POS,post,Financial Affairs,Other Financial Affairs,Financial Services
18151,"Really surprised by how much $FB has now fallen. Thought there'd be some support around the 50d, but I guess not.",FB,NEG,post,Stock Affairs,Stock Price Movement,Interactive Media & Services
18152,$tsla bad day to short,TSLA,POS,post,Stock Affairs,Stock Price Movement,Automobiles
18154,"$TSLA TO RECALL 2,700 MODEL X SUVS FOR SEAT-BELT FIX",TSLA,NEG,post,Business Operations,Product Dynamics,Automobiles
18164,5 Best Analyst Rated Stocks in Last 72hrs: $ORCL $AAPL $CBS $INO $CPXX View all ratings here: https://t.co/IRID6zd5gc,ORCL,POS,post,Stock Affairs,Other Stock Affairs,Software
18169,Bought some more $CELG as it is ready for a bounce.,CELG,POS,post,Stock Affairs,Stock Price Movement,Biotechnology
18170,Analysts impressed with progress at Tesla's flagship factory; co spent $1.6B on upgrades in '15 https://t.co/SABxCSn8cd by @tsrandall $TSLA,TSLA,POS,post,Stock Affairs,Other Stock Affairs,Automobiles
18180,"$CELG back near 104, where it opened and rallied higher last wk. A good place to take a shot https://t.co/zwHThSvFSF",CELG,POS,post,Stock Affairs,Stock Price Movement,Biotechnology
18185,$AMZN new HOD with conviction keeping $570 on watch for Resistance.,AMZN,POS,post,Stock Affairs,Stock Price Movement,Broadline Retail
18186,$FB  rejecting HIGHS shortable...at 109,FB,NEG,post,Stock Affairs,Stock Price Movement,Interactive Media & Services
18196,"$CSX is up today to report.  Wall Street is expecting EPS to be at $0.37, and revenues at $2,732B.",CSX,POS,post,Financial Affairs,Profit Announcement,Ground Transportation
18206,$FB turns back down in early trading.... https://t.co/reuf5PzhBm,FB,NEG,post,Stock Affairs,Stock Price Movement,Interactive Media & Services
18207,Followed the levels I shared with you on $NFLX $GOOGL $TSLA calls for nice gains. Still holding $FB 110 calls. Week made in a morning.,FB,POS,post,Stock Affairs,Stock Price Movement,Interactive Media & Services
18211,"$FAST $GWW - daily sales slowing again, pretty timely coincident indicator https://t.co/m6BKHBkzK5",GWW,NEG,post,Financial Affairs,Other Financial Affairs,Trading Companies & Distributors
18213,"Tesla Motors recalls 2,700 Model X SUVs $TSLA https://t.co/xDGrAExkKz",TSLA,NEG,post,Business Operations,Product Dynamics,Automobiles
18217,"SiriusXM added 465,000 net new subscribers in the first quarter of 2016 $SIRI #CEO #sales #marketresearch #tech #entrepreneur #Speaker",SIRI,POS,post,Financial Affairs,Other Financial Affairs,Entertainment
18218,5-star analyst @brianwieser from Pivotal Research upgraded rating on $GOOGL to BUY. Brian has a 79% success rate https://t.co/t0dn02EOH5,GOOGL,POS,post,Stock Affairs,Other Stock Affairs,Interactive Media & Services
18219,Long $ENDP @ $26.23 on $AGN b/o rumor,ENDP,POS,post,Stock Affairs,Stock Price Movement,Biotechnology
18226,"You know that back seat? Don't sit in it. - $TSLA -> Tesla recalls 2,700 Model X cars https://t.co/7J0Gwz89ZC",TSLA,NEG,post,Business Operations,Product Dynamics,Automobiles
18229,This $BBBY stock options trade would have more than doubled your money https://t.co/Oa0loiRIJL via @TheStreet,BBBY,POS,post,Stock Affairs,Other Stock Affairs,Specialty Retail
18237,X marks the recall: Tesla recalls #ModelX for faulty 3rd row seat. https://t.co/HSqdoVry07 $TSLA https://t.co/4Cs3CNZEBB,TSLA,NEG,post,Business Operations,Product Dynamics,Automobiles
18250,$STX move off the bottom but still in bear market #datasecurity $EMC $SNDK $WDC https://t.co/VkYdWPxeSN,WDC,NEG,post,Business Operations,"Sales, Market Share Changes","Technology Hardware, Storage & Peripherals"
18259,$VRTX early technical BUY signal... for confirmation > 86 it needs some fundam. incentive https://t.co/QuYSrqFo2x,VRTX,POS,post,Stock Affairs,Stock Price Movement,Biotechnology
18272,$FB (110.20) is starting to show some relative strength and signs of potential B/O on the daily.,FB,POS,post,Stock Affairs,Stock Price Movement,Interactive Media & Services
18275,"@CGrantWSJ I think this $TSLA bubble might go on for some time. So long as ppl love the cars, they might keep getting funding.",TSLA,POS,post,Stock Affairs,Stock Price Movement,Automobiles
18285,$SBUX heading for the 200DMA and certain doom if it can not hold there.,SBUX,NEG,post,Stock Affairs,Stock Price Movement,"Hotels, Restaurants & Leisure"
18307,$AMZN long into earnings. looks good over 600,AMZN,POS,post,Stock Affairs,Stock Price Movement,Broadline Retail
18312,$GOOGL is a short below 740 into the upper BB and is overbought,GOOGL,NEG,post,Stock Affairs,Stock Price Movement,Interactive Media & Services
18313,Timberrrr $TSLA https://t.co/MRBgfDHHVa,TSLA,NEG,post,Stock Affairs,Stock Price Movement,Automobiles
18323,Interest Heats Up for @Yahoo $YHOO - The Wall Street Journal  https://t.co/j5jVjI9bia,YHOO,POS,post,Business Operations,Other Business Operations Affairs,Interactive Media & Services
18340,"Tesla Recalling 2,700 Model X Units, Related to Faulty Latch for Third-Row Seats; Fall To $252.50 Level on Recall, Shares Up 1%  $TSLA",TSLA,NEG,post,Business Operations,Product Dynamics,Automobiles
18349,Commented on It's Time To Embrace Dividend Growth https://t.co/wc2qfP79TN $ABBV $CSCO $WYN,WYN,POS,post,Shareholder Affairs,Other Shareholder Affairs,"Hotels, Restaurants & Leisure"
18351,Word on the street is that Allergen is looking at Endo International after the failed Pfizer merger. May-20 $35 calls active. $ENDP,ENDP,POS,post,Financing and Investment,Mergers and Acquisitions,Biotechnology
18354,$SBUX inverted head & shoulders pattern in the works. bullish.,SBUX,POS,post,Stock Affairs,Stock Price Movement,"Hotels, Restaurants & Leisure"
18361,I see a 20 percent upside in $FB shares from here,FB,POS,post,Stock Affairs,Stock Price Movement,Interactive Media & Services
18370,long $AAPL,AAPL,POS,post,Stock Affairs,Stock Price Movement,Household Durables
18383,$FB popping up to HOD,FB,POS,post,Stock Affairs,Stock Price Movement,Interactive Media & Services
